product_id,product_name,category_id,brand,price,cost,stock_quantity,weight_kg,dimensions,description,is_active,created_at
1,Centralized attitude-oriented synergy,164,Fender,120.22,49.48,754,5.21,194x144x13,Hotel quickly amount care meet. Likely consider agreement citizen organization.,True,2024-05-12T00:44:32.354038
2,Reactive asynchronous analyzer,9,Adidas,19.75,10.92,27,28.11,188x171x91,Wish white also. Natural career woman across central information instead.,True,2024-06-13T17:16:40.512421
3,Polarized static flexibility,57,Dr. Martens,454.72,334.06,777,40.31,183x113x45,Senior go talk down story forget. Career make law thousand again whose south.,True,2025-01-02T18:13:21.175439
4,Persevering homogeneous Graphic Interface,56,Tiffany & Co.,957.64,331.7,99,18.01,93x159x35,"Exist little add economy discussion across. Performance both week.
Stay them wide control campaign card enough. Wide under attack suggest.",True,2024-12-15T11:32:56.088835
5,Compatible non-volatile array,118,IKEA,540.87,311.55,849,31.47,97x152x26,Stuff evening north city he sit style poor. Perform research finally western. Certain everyone weight agreement.,True,2023-12-05T09:19:11.197502
6,Total background encoding,12,Penguin,67.14,48.86,887,5.14,76x121x83,It reach Democrat little chance human reason. Argue upon single all. Single door throw increase career number.,True,2023-07-26T19:59:12.767668
